{
  "$schema": "../schema/b32k_indexing_profile.schema.json",
  "aletheos_root": {
    "catalogue_address": 2,
    "key": "ALETHEOS_ROOT",
    "lane_index": 1,
    "wire_index": 1
  },
  "coordinates": {
    "catalogue_address": {
      "maximum": 32768,
      "minimum": 1,
      "zero_status": "outside_registry"
    },
    "lane_index": {
      "maximum": 32767,
      "minimum": 0,
      "scope": "lane_local"
    },
    "wire_index": {
      "bit_width": 15,
      "maximum": 32767,
      "minimum": 0
    }
  },
  "id": "b32k_indexing_profile_001",
  "invariants": {
    "addresses_must_not_drift": true,
    "catalogue_address_count": 32768,
    "catalogue_address_zero_is_legal": false,
    "definitions_may_mature": true,
    "registered_null_has_positive_authority": false,
    "wire_index_count": 32768,
    "wire_index_zero_is_legal": true
  },
  "mapping": {
    "catalogue_address_from_wire_index": "wire_index + 1",
    "direct_lane_to_catalogue_mapping": "catalogue_address = lane_index + 1",
    "wire_index_from_catalogue_address": "catalogue_address - 1"
  },
  "nonclaims": {
    "glyph_confers_authority": false,
    "semantic_definition_changes_address": false,
    "wire_index_is_catalogue_address": false
  },
  "profile_id": "b32k.indexing.current-repo.001",
  "reserved_boundary": {
    "catalogue_address": 1,
    "key": "NULL_WELL",
    "lane_index": 0,
    "meaning": "Registered null. Unbound socket. No positive authority.",
    "wire_index": 0
  },
  "schema_version": "1.0.0",
  "source": {
    "canonical_alphabet": "src/b32k/b32k.json",
    "canonical_index": "artifacts/json/b32k_aletheos_canonical_index_001.json",
    "repository_head_at_derivation": "c57eed93c554699ab37a7278421fe9bd33babd4c"
  },
  "status": "derived_current_repository_contract"
}
